### ISSUE TITLE
Pihole is not respecting Forward DNS for "update" queries from Win clients

### ISSUE THREAD

**Issue by the-dreamer** [pi-hole/pi-hole#5308]
### Versions

- Pi-hole:  5.17.1
- AdminLTE:  
- FTL:  5.23

### Platform

- OS and version:  Fedora 38

- Platform:  Rpi4
### Expected behavior

Pihole is on port 53 for network and forwading via unbound on port 5053 all queries excluding local dns queries for Samba which is newly on the same host on port 53053. 

Normal operations are working as expected. All queries for local AD-DC domain are forwarded to :53053. Also PTR is working. 

everything else is going to unbound on port 5053. 

When a windows client for example or also a sssd client form linux is updating the ip information, the client is asking the hostname of the nameserver, which is answered by AD-DC and the client is resolving it and afterwards the windows client is directly contacting the nameserver of the AD-DC. This is newly on the same host. 

Expected behaviour is, pi hole is forwarding the query to the port 53053.   

### Actual behavior / bug
Pi hole is forwading this update query to the unbound service on port 5053

here a snip from tcpdump: 

17:53:04.641660 end0  In  IP 192.168.10.142.56994 > 192.168.10.3.53: 49064 update [1a] [5n] SOA? myaddc.mydomain.de. (164)
17:53:04.642066 lo    In  IP6 ::1.5053 > ::1.32880: UDP, length 164
17:53:04.642261 end0  Out IP 192.168.10.3.53 > 192.168.10.142.56994: 49064 update NotImp 1/5/0 (Class 254) CNAME windowclient.myaddc..mydomain.de.  (164)

### Steps to reproduce

Pihole on Port 53
unbound on port 5053
samba dns port 53053

conf: 

server=::1#5053
server=/mydomain.de/::1#53053

from windows ad windows client execute 
ipconfig /registerdns

## Debug Token
 This was somehow not working: 

********************************************
********************************************
[✓] ** FINISHED DEBUGGING! **

   * The debug log can be uploaded to tricorder.pi-hole.net for sharing with developers only.

[?] Would you like to upload the log? [y/N] y
    * Using curl for transmission.
    * curl failed, contact Pi-hole support for assistance.
    * Error message: curl: (22) The requested URL returned error: 500

[✗] There was an error uploading your debug log.
   * Please try again or contact the Pi-hole team for assistance.
   * A local copy of the debug log can be found at: /var/log/pihole/pihole_debug.log

If more informations are needed, i will provide.

**Comment by dschaper** [comment]
Please provide a new debug token URL and an update if this is still an issue.

**Comment by wblew** [comment]
Just a thought: You might want to Wireshark your use case's client to/from Pi-hole host traffic on ports 53 and 53053.

The 'register with AD' looks for an authoritative server for the AD domain, using recursive DNS. I.e. the Pi-hole service.

It then transacts a DNS update with the discovered authoritative (SOA record) server. Perhaps the client is defaulting to port 53, instead of port 53053 on the server hostname? Recall, there is no provision for custom DNS ports for authoritative servers. The
SOA record lacks any port specification.

I also have samba-ad-dc, and Pi-hole services running on the same host. But I'm using docker with a Macvlan network to give the Pi-hole and samba-ad-dc different IP addresses on my network, both bound to port 53. AD dns updates are working in my case.

**Comment by the-dreamer** [comment]
Yes, the client is using always the default port 53 for update query. this cannot be changed. As i have described, the problem is, that the query is forwarded to the default upstream dns and not to the ad dc dns. 

As samba has now custom dns port support i have moved it to rpi to have the more stable seperation of addc and file server. 

so long the ip of the addc is different from default dns, everything is working, but when pi hole is getting the query the forward entries are not used in the expected way and the query (only the update query!!) is forwarded to the default upstream dns. 

@dschaper, i will try next days again to upload a debug log. 


currently i am work around that issue, in the way, that now the default upstream dns is the samba server and the samba is forwarding all not known names to the unbound dns. sadly one more round.

**Comment by the-dreamer** [comment]
As there was no change after last update the issue is still open. I had still no time to reupload the logs

**Comment by the-dreamer** [comment]
due holiday no update on this, will do next days.

**Comment by the-dreamer** [comment]
I see, there is a new version. I'll update and then retest this issue.

**Comment by the-dreamer** [comment]
got no time.
